{"$schema":"https://json-schema.org/draft/2020-12/schema","$id":"https://prii.dev/schemas/executability-trace.schema.json","title":"Executability Trace Ledger","type":"object","required":["schema_version","generated_at","traces","coverage"],"properties":{"schema_version":{"const":"0.1.0"},"generated_at":{"type":"string","format":"date-time"},"traces":{"type":"array","items":{"type":"object","required":["trace_id","repository","commit","surface","path","observations","classification","confidence","evidence"],"properties":{"trace_id":{"type":"string","minLength":12},"repository":{"type":"string"},"commit":{"type":"string","pattern":"^[0-9a-f]{40}$"},"surface":{"type":"object","required":["kind","id"],"properties":{"kind":{"enum":["gui-control","route","command","workflow-stage","pipeline-edge","service","dependency"]},"id":{"type":"string"},"label":{"type":["string","null"]},"source":{"type":["string","null"]},"line":{"type":["integer","null"],"minimum":1}},"additionalProperties":false},"path":{"type":"array","items":{"type":"object","required":["node_id","kind","status"],"properties":{"node_id":{"type":"string"},"kind":{"type":"string"},"status":{"enum":["observed","declared","resolved","missing","blocked","failed","terminal"]},"source":{"type":["string","null"]}},"additionalProperties":false}},"observations":{"type":"object","additionalProperties":{"type":["boolean","string","number","null"]}},"classification":{"enum":["EXECUTABLE_CONFIRMED","EXECUTABLE_BY_CONTRACT","WIRED_BUT_BLOCKED","PARTIALLY_WIRED","UI_NO_OP","TARGET_MISSING","CONTRACT_MISMATCH","UNREACHABLE","PLACEHOLDER","RUNTIME_FAILURE","PRECONDITION_UNDECLARED","UNSAFE_TO_PROBE","INDETERMINATE"]},"fault_boundary":{"type":["string","null"]},"confidence":{"type":"number","minimum":0,"maximum":1},"evidence":{"type":"array","items":{"type":"object","required":["tier","kind","locator"],"properties":{"tier":{"enum":["T1","T2","T3","T4"]},"kind":{"type":"string"},"locator":{"type":"string"},"digest":{"type":["string","null"]}},"additionalProperties":false}},"recommended_fix":{"type":["string","null"]}},"additionalProperties":false}},"coverage":{"type":"object","required":["surfaces_discovered","surfaces_classified","t1_or_t2_supported","by_kind","classification_counts","repositories_present","repositories_missing"],"properties":{"surfaces_discovered":{"type":"integer","minimum":0},"surfaces_classified":{"type":"integer","minimum":0},"t1_or_t2_supported":{"type":"integer","minimum":0},"by_kind":{"type":"object","additionalProperties":{"type":"integer","minimum":0}},"classification_counts":{"type":"object","additionalProperties":{"type":"integer","minimum":0}},"repositories_present":{"type":"integer","minimum":0},"repositories_missing":{"type":"integer","minimum":0}},"additionalProperties":false},"workspace_gaps":{"type":"array","items":{"type":"string"}}},"additionalProperties":false}
