{"schema_version":"0.1.0","generated_at":"2026-08-06T22:48:52.398054+00:00","traces":[{"trace_id":"9ce8ff9863b26d9290750766","repository":"Jotaele44/thehub-pr","commit":"a5bad05ce5eec4cc73e2eed8569d294bc3f5cd27","surface":{"kind":"gui-control","id":"9ce8ff9863b26d9290750766","label":"CSV","source":"server/frontend/src/components/exports/LedgerExportRow.jsx","line":43},"path":[{"node_id":"3bde68b738a32254fe9d6239","kind":"gui-control","status":"observed","source":"server/frontend/src/components/exports/LedgerExportRow.jsx"},{"node_id":"90665ceca3f9ba23b2da2ccf","kind":"event-handler","status":"resolved","source":"server/frontend/src/components/exports/LedgerExportRow.jsx"},{"node_id":"aff2f9e8023e2cf1301d67c5","kind":"local-target","status":"resolved","source":null}],"observations":{"handler_bound":true,"side_effect_intercepted":false,"handler_resolved":true,"intent_observed":true,"boundary_reached":true,"contract_matched":true,"static_contract_resolved":true},"classification":"EXECUTABLE_BY_CONTRACT","fault_boundary":null,"confidence":0.97,"evidence":[{"tier":"T1","kind":"source","locator":"server/frontend/src/components/exports/LedgerExportRow.jsx:43","digest":null}],"recommended_fix":"Graduate to a disposable shadow dependency for runtime confirmation."},{"trace_id":"2685c433b0cc6cb7a5741d9a","repository":"Jotaele44/thehub-pr","commit":"a5bad05ce5eec4cc73e2eed8569d294bc3f5cd27","surface":{"kind":"gui-control","id":"2685c433b0cc6cb7a5741d9a","label":"GeoJSON","source":"server/frontend/src/components/exports/LedgerExportRow.jsx","line":47},"path":[{"node_id":"d49bd7eb0bf8589924ccf8d7","kind":"gui-control","status":"observed","source":"server/frontend/src/components/exports/LedgerExportRow.jsx"},{"node_id":"26731d6a7afde6b6c7ef72ec","kind":"event-handler","status":"resolved","source":"server/frontend/src/components/exports/LedgerExportRow.jsx"},{"node_id":"2a734162f5a15ed4c3fb200f","kind":"local-target","status":"resolved","source":null}],"observations":{"handler_bound":true,"side_effect_intercepted":false,"handler_resolved":true,"intent_observed":true,"boundary_reached":true,"contract_matched":true,"static_contract_resolved":true},"classification":"EXECUTABLE_BY_CONTRACT","fault_boundary":null,"confidence":0.97,"evidence":[{"tier":"T1","kind":"source","locator":"server/frontend/src/components/exports/LedgerExportRow.jsx:47","digest":null}],"recommended_fix":"Graduate to a disposable shadow dependency for runtime confirmation."}],"coverage":{"surfaces_discovered":2,"surfaces_classified":2,"t1_or_t2_supported":2,"by_kind":{"gui-control":2},"classification_counts":{"EXECUTABLE_BY_CONTRACT":2},"repositories_present":1,"repositories_missing":0},"workspace_gaps":[]}
